{
  "version": 2,
  "inputFormat": "json",
  "outputFormat": "json",
  "fieldMappings": [],
  "arrayMappings": [
    {
      "inputPath": "items",
      "outputPath": "users",
      "coerceSingle": true,
      "itemMappings": [
        {
          "outputPath": "name",
          "source": { "type": "path", "path": "name" }
        }
      ]
    }
  ]
}
